{
  "id": "infoculture-7702389486",
  "name": "АНО Инфокультура",
  "inn": "7702389486",
  "projects": [
    {
      "id": "ik-webarchive",
      "name": "Национальный цифровой архив России",
      "funding_org": {
        "inn": "0000000000",
        "name": "Краудфандинг"
      },
      "receiver_org": {
        "inn": "7702389486",
        "name": "АНО Инфокультура"
      },
      "description": "Проект создан в целях архивации исчезающих сайтов Рунета. Задачи впроекта влючают: сбор коллекции сайтов",
      "summ": 14000,
      "category": [
        {
          "code": "0007",
          "name": "Открытость и прозрачность"
        },
        {
          "code": "0011",
          "name": "Культурное наследие"
        }
      ],
      "execution_date": "02.2017-",
      "report": null
    },
    {
      "id": "ik-plainrussian",
      "name": "Простой русский язык",
      "funding_org": {
        "inn": "0000000000",
        "name": "Краудфандинг"
      },
      "receiver_org": {
        "inn": "7702389486",
        "name": "АНО Инфокультура"
      },
      "description": "Сервис оценки простоты русского языка, https://plainrussian.ru",
      "summ": 3500,
      "category": [
        {
          "code": "0007",
          "name": "Открытость и прозрачность"
        }
      ],
      "execution_date": "01.2016-",
      "report": null
    }
  ]
}
